{
  "$schema": "https://json-schema.org/draft/2020-12/schema",
  "$id": "https://internal.example.invalid/k2-002/ep01/sh12/r5-anchor-only.schema.json",
  "title": "K2-002 EP01 SH12 R5 anchor-only fixed-seed experiment",
  "type": "object",
  "additionalProperties": false,
  "required": [
    "schemaVersion",
    "experimentId",
    "authorityState",
    "publicationAllowed",
    "canonicalMutations",
    "shotId",
    "changedVariable",
    "maxRuns",
    "baseline",
    "variant",
    "allowedWorkflowDiffPointers"
  ],
  "properties": {
    "schemaVersion": {"type": "integer", "const": 1},
    "experimentId": {"const": "K2-002-EP01-SH12-R5-ANCHOR-ONLY"},
    "authorityState": {"const": "TECHNICAL_EVIDENCE_ONLY"},
    "publicationAllowed": {"type": "boolean", "const": false},
    "canonicalMutations": {"type": "integer", "const": 0},
    "shotId": {"const": "EP01_SH12"},
    "changedVariable": {"const": "START_ANCHOR_ONLY"},
    "maxRuns": {"type": "integer", "const": 1},
    "baseline": {
      "type": "object",
      "additionalProperties": false,
      "required": [
        "shotsSha256",
        "workflowFileSha256",
        "workflowCanonicalSha256",
        "anchorSha256",
        "seed",
        "positivePromptSha256",
        "negativePromptSha256",
        "modelSha256",
        "comfyuiCommit"
      ],
      "properties": {
        "shotsSha256": {"const": "52e24c8c781f2c729239d6152246677c8eb633d43d17463550c22bb91c8fd9c9"},
        "workflowFileSha256": {"const": "374533b301660ce77b645fc706c185efb9cc3cf070330c4bae44078d0d34bb65"},
        "workflowCanonicalSha256": {"const": "ead8128c3625e9ecea76fe18059ae0439136134aa1af1c4b44a2861f359122cd"},
        "anchorSha256": {"const": "21ef1ff9b874bf8be850702afd34acc1885bb22cd909b8587097b092eaea2827"},
        "seed": {"type": "integer", "const": 596974677755723},
        "positivePromptSha256": {"const": "c321d403fe740753a807033b490c181d431ccc03b22924ef7da44940dfbf3f85"},
        "negativePromptSha256": {"const": "02064208e66afa23a1290b1c2f79c71126267c93d2465081849e20f25265c75e"},
        "comfyuiCommit": {"const": "feca51a8544511dd73d43602f387def0cc601a9d"},
        "modelSha256": {
          "type": "object",
          "additionalProperties": false,
          "required": ["UNET", "TEXT_ENCODER", "VAE"],
          "properties": {
            "UNET": {"const": "456f901338bd9eadbded3828b819109a9b68e8a525ca5cf8d0049a69fcfeca1e"},
            "TEXT_ENCODER": {"const": "c3355d30191f1f066b26d93fba017ae9809dce6c627dda5f6a66eaa651204f68"},
            "VAE": {"const": "e40321bd36b9709991dae2530eb4ac303dd168276980d3e9bc4b6e2b75fed156"}
          }
        }
      }
    },
    "variant": {
      "type": "object",
      "additionalProperties": false,
      "required": ["anchorPath", "anchorSha256", "seedPolicy", "seed"],
      "properties": {
        "anchorPath": {
          "type": "string",
          "pattern": "^/data/k2-technical-evidence/k2-002-ep01-i2v-v2-sh12-r5-anchor-only/inputs/[^/]+\\.png$"
        },
        "anchorSha256": {
          "type": "string",
          "pattern": "^[0-9a-f]{64}$",
          "not": {"const": "21ef1ff9b874bf8be850702afd34acc1885bb22cd909b8587097b092eaea2827"}
        },
        "seedPolicy": {"const": "FIXED_BASELINE_SEED"},
        "seed": {"type": "integer", "const": 596974677755723}
      }
    },
    "allowedWorkflowDiffPointers": {
      "type": "array",
      "prefixItems": [{"const": "/12/inputs/image"}],
      "items": false,
      "minItems": 1,
      "maxItems": 1
    }
  }
}